sentence,concept_aptitude_avg,concept_aptitude_sum,concept_attention_avg,concept_attention_sum,concept_pleasantness_avg,concept_pleasantness_sum,concept_polarity_avg,concept_polarity_sum,concept_sensitivity_avg,concept_sensitivity_sum,subjectivity
"Excelente Produto!! É só clicar na foto, entrar e comprar... http://fb.me/3qfzWthdv",0.0139333333333333,0.2089999999999999,-0.0008666666666666,-0.0129999999999999,-0.0058,-0.087,-0.0089333333333333,-0.1339999999999999,0.0508666666666666,0.763,0.0
Elado dell notebook http://www.szuperpiac.hu/hirdetes-id-203099.htm …,0.0,0.0,0.0,0.0,0.0,0.0,0.0,0.0,0.0,0.0,0.0
"Notebook Dell Vostro V14T 5470-A50, Processador Intel Core i7 Memória 8GB HD 500GB Windows 8... http://fb.me/3DDNn5E79",0.0036190476190476,0.076,0.0447619047619047,0.94,0.0415714285714285,0.873,0.0297142857142857,0.624,0.0007619047619047,0.016,0.0
"#Informática , Troque de notebook hoje na #FnacPortoAlegre e garanta uma caneca com a sua caricatura! #Dell  Link permanente da imagem incorporada",-0.023037037037037,-0.622,-0.0174074074074074,-0.47,-0.0188888888888888,-0.51,-0.0172222222222222,-0.4649999999999998,0.0504444444444444,1.362,0.0
Dell Latitude D505 Notebook specs: Dimensions W x H x D : 338 331 273 cm Display diagonal  Link permanente da imagem incorporada,-0.0474399999999999,-1.186,0.0114399999999999,0.286,-0.06164,-1.541,-0.0552399999999999,-1.3809999999999998,0.0602,1.505,0.0
Aceito doações de carregador para notebook dell ou universal Agradecida,0.1069,1.069,-0.1526,-1.526,0.1523,1.523,0.1373,1.373,0.0,0.0,0.0
quanto custa pra eu trocar o hd de um notebook dell por um ssd?,0.0035333333333333,0.0530000000000001,-0.1181333333333333,-1.772,-0.0239999999999999,-0.3599999999999999,0.0326,0.4890000000000002,0.0,0.0,0.0
"Confira da ofertas de submarino: Andrey_Peixoto, recomendamos esse daqui, ó >>> http://scup.it/8fzg",0.0261764705882352,0.445,-0.057235294117647,-0.973,0.0494117647058823,0.84,0.0442941176470588,0.753,0.0,0.0,0.0
@zerodomo Não trabalhamos com brindes. =_( Mas vou te enviar o link do notebook com desconto: http://pingu.im/1PtvEzz  =),0.0079130434782608,0.182,0.0853478260869565,1.963,0.078391304347826,1.803,0.0557826086956521,1.283,-0.0042608695652173,-0.098,0.0
Dell lança versão de notebook 2 em 1 com processador top e mais autonomia. Veja: http://goo.gl/zpYvzy  http://fb.me/2ZgUY9sBj,0.02965,0.593,-0.0458499999999999,-0.917,0.0473499999999999,0.947,0.0441,0.8820000000000001,0.0008,0.016,0.0
"Se me permitissem escolher o novo Macbook e o Dell XPS 13,eu escolheria fácil o modelo da Dell. É muito mais notebook.",0.0069999999999999,0.1679999999999999,-0.0085833333333333,-0.2059999999999999,0.0184166666666666,0.4419999999999999,0.0119166666666666,0.286,0.0141666666666666,0.3400000000000001,1.0
Descubra como resolver problemas da tela de seu notebook Dell ? - http://dell.to/1x3yVfk   Ver foto,0.109375,1.7500000000000002,0.0694375,1.111,0.110875,1.7740000000000002,0.133625,2.138,-0.0105625,-0.169,0.0
Nas 48hs de ofertas você também encontra Notebooks. Com a qualidade Dell e um preço que você não pode deixar passar! http://mvoce.com/1GwVRuu,0.0324583333333333,0.7790000000000002,-0.0732916666666666,-1.759,0.0307083333333333,0.7369999999999999,0.0500833333333333,1.2020000000000002,0.0,0.0,0.0
"Dell anuncia nova versão do notebook XPS13, com boa configuração e rodando Ubuntu: A Dell… http://goo.gl/fb/QJ2pW8",0.0,0.0,0.0,0.0,0.0,0.0,0.0,0.0,0.0,0.0,0.0
Excelente Produto... Oportunidade!! http://fb.me/2T7mbUdDc,0.1511428571428571,1.058,0.0524285714285714,0.367,0.1154285714285714,0.808,0.0945714285714285,0.662,-0.0235714285714285,-0.1649999999999999,0.0
Nova versão do tablet Venue 10 da Dell vira notebook com Android - http://goo.gl/alerts/75fC  #GoogleAlerts,0.0,0.0,0.0,0.0,0.0,0.0,0.0,0.0,0.0,0.0,0.0
17 aprile: incontro con Gianandrea Noseda al Notebook dell'Auditorium - ingresso libero http://www.santacecilia.it/concerti_e_biglietti/schedaEvento.html?i=1000011111&d=20150417&o=18.30 …  Link permanente da imagem incorporada,-0.0337619047619047,-0.709,-0.0257619047619047,-0.5409999999999999,-0.0301428571428571,-0.6329999999999999,-0.0334285714285714,-0.702,0.0691428571428571,1.452,0.0
VENDO NOTEBOOK  DELL 14 INSPIRACION - BARBADA!!!!,-0.0739166666666666,-0.887,0.0,0.0,-0.0615833333333333,-0.739,-0.0677499999999999,-0.813,0.0678333333333333,0.814,0.0
Super ofertas em apenas 48horas. E você concorre a um condomínio inteiro!,-0.0506428571428571,-0.709,0.0079285714285714,0.111,-0.0674285714285714,-0.944,-0.0367142857142857,-0.5139999999999999,0.0,0.0,0.0
BeLuArte busca ofertas para você. Confira e participe do sorteio. http://goo.gl/TP1nGD,-0.0016923076923076,-0.022,-0.0437692307692307,-0.569,0.0659230769230769,0.857,0.0112307692307692,0.146,0.0743846153846153,0.967,0.0
"Dica de Compra , Notebook Dell Inspiron i14-5447-A30, por R$ 2.499 (em 09-04-2015) http://bit.ly/1Pp31U4   Link permanente da imagem incorporada",-0.027391304347826,-0.63,-0.024695652173913,-0.5680000000000001,-0.0299130434782608,-0.688,-0.0238695652173913,-0.5489999999999999,0.0606521739130434,1.395,0.0
Ofertas em Notebooks DELL http://migre.me/oEfq1  + Cupom de Desconto: RCA-27231,0.12325,1.479,-0.0505833333333333,-0.607,0.2259166666666666,2.7110000000000003,0.1853333333333333,2.224,0.0,0.0,0.0
"Dell Vostro 14 3445 Notebook  for Rs 18,990",0.0,0.0,0.0,0.0,0.0,0.0,0.0,0.0,0.0,0.0,0.0
Nova versão do tablet Venue 10 da Dell vira notebook com Android (via TechTudo): A Dell apresentou a versão de 10 … http://ift.tt/1DMJ46K,0.0221153846153846,0.5750000000000001,-0.0374230769230769,-0.973,0.0331153846153846,0.861,0.0308846153846153,0.803,0.0,0.0,0.0
"Notebook Dell Inspiron 15 com Intel® Core™ i7-4500U, Tela 15,6"" Touch, 16GB de RAM, 1TB de HD,... http://fb.me/3SpF8KlEm",0.0390714285714285,1.094,-0.0670714285714285,-1.878,0.0618928571428571,1.733,0.0570357142857142,1.597,-0.0018571428571428,-0.052,0.0
GENTE!!!,0.0,0.0,0.0,0.0,0.0,0.0,0.0,0.0,0.0,0.0,0.0
"Só de lembrar que o meu notebook é um Dell de 2005, meu coração já sente que não vai conseguir comprar ingressos para RiR ?",0.0451923076923076,1.175,-0.113076923076923,-2.94,0.0801538461538461,2.084,0.0795,2.067,0.0,0.0,0.0
Notebook's para venda:,0.1699999999999999,0.85,0.1868,0.934,0.1582,0.791,0.1716,0.858,0.0,0.0,0.0
"No chat online da Dell Eu: Acusa erro no hard drive, não acessa o windows. Técnico: Ok. Vc está no chat através do notebook?",-0.0235333333333333,-0.706,0.0,0.0,-0.0243333333333333,-0.73,-0.0218666666666666,-0.656,0.0177666666666666,0.533,1.0
Dell lança versão de notebook 2 em 1 com processador e mais autonomia http://ow.ly/LjpDB,0.0423571428571428,0.593,-0.0654999999999999,-0.917,0.0676428571428571,0.947,0.063,0.8820000000000001,0.0011428571428571,0.016,0.0
Notebook DELL com esse preço?! :O corra até uma de nossas lojas ou acesse nosso site e aproveite! ultimas... http://fb.me/7c02KeNoj,0.0557083333333333,1.3370000000000002,-0.0662083333333333,-1.589,0.0720416666666666,1.729,0.071875,1.725,-0.002375,-0.057,0.0
Meu notebook dell não está entrando no Windows. E olha que eu desliguei ele certinho ontem a noite.,0.0467999999999999,0.936,0.0470499999999999,0.941,0.0,0.0,0.03035,0.607,0.00315,0.063,1.0
Novidade na loja LOJAS LEONARDO LTDA: Notebook Dell Latitude 610. Acesse: http://is.gd/KELPWP,0.0167333333333333,0.251,0.0080666666666666,0.121,0.0135333333333333,0.203,0.0158666666666666,0.238,-0.0032,-0.048,0.0
"Notebook Dell Vostro V14T 5470-A50, Processador Intel Core i7 Memória 8GB HD 500GB Windows 8... http://fb.me/4LbgbIEaG",0.0036190476190476,0.076,0.0447619047619047,0.94,0.0415714285714285,0.873,0.0297142857142857,0.624,0.0007619047619047,0.016,0.0
Aprenda a otimizar a vida útil da bateria de seu notebook Dell ? - http://dell.to/1nSusc2   Ver foto,0.0953333333333333,1.716,0.0109999999999999,0.1979999999999999,0.1019444444444444,1.835,0.1032777777777777,1.859,-0.0065,-0.117,0.0
Dell lança versão de notebook 2 em 1 com processador top e mais autonomia (via TechTudo): A Dell atualizou a linha… http://ift.tt/1c4XaUO,0.05792,1.448,-0.07432,-1.858,0.07256,1.814,0.07076,1.769,0.00064,0.016,0.0
TechTudo: Dell lança versão de notebook 2 em 1 com processad... http://blog.techtudo.net/2015/04/dell-lanca-versao-de-notebook-2-em-1.html?spref=tw …,0.0344666666666666,0.517,-0.0679333333333333,-1.019,0.0631333333333333,0.947,0.0552,0.8280000000000001,0.0,0.0,0.0
Como consertar notebook da Dell com defeito.: http://youtu.be/XgWWBz8_RP8?a  via @YouTube,-0.006076923076923,-0.079,-0.003,-0.039,-0.0154615384615384,-0.201,-0.0068461538461538,-0.089,0.002,0.026,0.0
Notebook Dell Inspiron 14 série 3000 por R$1313. 26% de desconto! #AteAcabar http://ateacabar.com/product/15201,0.063,1.134,-0.0472777777777777,-0.8509999999999998,0.1487777777777778,2.678,0.1210555555555555,2.1790000000000003,0.0,0.0,0.0
Ofertas em Notebooks DELL http://migre.me/oEfq1  + Cupom de Desconto: RCA-27231,0.12325,1.479,-0.0505833333333333,-0.607,0.2259166666666666,2.7110000000000003,0.1853333333333333,2.224,0.0,0.0,0.0
Cargadores Originales Para Notebook:  -Acer -Asus -Dell -HP -Lenovo -Sony -Samsung -Toshiba -P. Bell -MAC  Link permanente da imagem incorporada,-0.0582173913043478,-1.339,0.0075217391304347,0.173,-0.068,-1.564,-0.0634782608695652,-1.46,0.0631304347826087,1.452,0.0
"#Oferta  Notebook Dell Inspiron De R$2.099,00 por R$1.749,00  Detalhes em - >http://bit.ly/1ICFaep   Link permanente da imagem incorporada",-0.018875,-0.4529999999999999,-0.01975,-0.474,-0.0301666666666666,-0.724,-0.0227499999999999,-0.5459999999999998,0.0486666666666666,1.168,0.0
@ELeaojr Bom dia! O desconto de aniversário nunca é acumulativo c outras promoções! Conseguimos esse item pra vc por: http://extra.vc/1PbUGTL,0.0576521739130434,1.3259999999999998,-0.0367391304347826,-0.845,0.1166521739130434,2.683,0.0957391304347826,2.202,-0.005391304347826,-0.124,0.0
"De R$ 1.849,00 por R$ 1.699,00 em até 10x de R$ 169,90 sem juros no cartão de crédito ou R$ 1.529,10 à vista.... http://fb.me/7kxijG0WH",0.0892,2.23,-0.21596,-5.399,0.16424,4.106,0.14868,3.717000000000001,0.02336,0.584,0.0
vou pedir pra minha mãe providenciar um notebook da dell pq fui instalar simcity desktop e o outro morreu,0.0111578947368421,0.212,0.0488947368421052,0.929,-0.0521052631578947,-0.99,0.0026842105263157,0.051,0.0,0.0,0.0
notebook dell muito rui cores rui brilho de tela rui,-0.0899,-0.899,-0.0905,-0.905,-0.0361,-0.361,-0.0478999999999999,-0.4789999999999999,0.1117,1.117,1.0
"Notebook Dell Inspiron I14-5447-A10 com Intel Core i5 4GB (2GB Memória Dedicada) 1TB LED 14"" Windows 8.1 http://oferta.vc/750T  #oferta",0.0131785714285714,0.369,0.0415714285714285,1.164,0.0311785714285714,0.873,0.0252499999999999,0.707,-0.0101428571428571,-0.284,0.0
"Notebook Dell com Intel® Core™ i3-4005U, Tela 14"", 4GB de Memória, 1TB de HD e Windows 8.1 -... http://fb.me/35fS6coTR",0.0390714285714285,1.094,-0.0371428571428571,-1.04,0.0930714285714285,2.606,0.0773928571428571,2.1670000000000003,-0.0018571428571428,-0.052,0.0
"Tem um mlk vendendo um notebook da Dell por 1000, sendo que vale 3500, lá vai um nootbook roubado",-0.0637619047619047,-1.339,-0.0309523809523809,-0.65,-0.1079999999999999,-2.268,-0.0469047619047619,-0.985,0.0,0.0,0.0
proximo notebook vou comprar da acer pq dell nunca mais que coisa horrivv,0.0123076923076923,0.16,0.0002307692307692,0.003,0.0086153846153846,0.1119999999999999,0.0135384615384615,0.176,0.0,0.0,1.0
"O @pontofrio ta vendendo um Notebook Dell Core I5 pela bagatela de R$9499,00. Vai Perder? #fail #SQN http://www.pontofrio.com.br/Informatica/Notebook/Notebook-Dell-Inspiron-I14-3442-A30-com-Intel-Core-i5-4210U-4GB-1TB-Gravador-de-DVD-Leitor-de-Cartoes-HDMI-Bluetooth-LED-14-e-Windows-8-1-3500187.html?utm_source=afilio&amp;utm_medium=newsferramenta&amp;utm_campaign=2015-04-01_OfertasMix_Afilio&amp;cid=009191615 …",-0.0396666666666666,-0.952,-0.0680416666666666,-1.633,-0.0425,-1.02,-0.0182916666666666,-0.4389999999999999,0.0408333333333333,0.98,0.0
"amigas, vcs que entendem de hardware de notebook: é possível usar peças de um HP num Dell?",0.0608999999999999,1.218,-0.1324,-2.648,0.0777,1.554,0.0978,1.956,-0.00495,-0.099,0.0
"Hoje estaremos nas lojas Fnac da Paulista e Pinheiros, em parceria com a Dell na ação de lançamento do notebook 2... http://fb.me/2MTb0rxyt",0.0460833333333333,1.106,-0.0227083333333333,-0.5449999999999999,0.0387083333333333,0.929,0.0459583333333333,1.103,-0.0053333333333333,-0.128,0.0
"De R$ 2.249,00 por R$ 1.899,00 em até 10x de R$ 189,90 sem juros no cartão de crédito ou R$ 1.709,10 à vista.... http://fb.me/3srA11aUJ",0.0892,2.23,-0.21596,-5.399,0.16424,4.106,0.14868,3.717000000000001,0.02336,0.584,0.0
"Notebook Dell Vostro V14T 5470-A20 Ultrafino, Processador Intel Core i5 Memória 4GB HD 500GB... http://fb.me/7vyXZrjEW",0.0038,0.076,0.047,0.94,0.04365,0.873,0.0312,0.624,0.0008,0.016,0.0
Ofertas em Notebooks DELL http://migre.me/oEfq1  + Cupom de Desconto: RCA-27231,0.12325,1.479,-0.0505833333333333,-0.607,0.2259166666666666,2.7110000000000003,0.1853333333333333,2.224,0.0,0.0,0.0
#SaldaoDeFeriado Notebook Dell Inspiron I14-3442-A10 4ª Geração do Processador Intel® Core i3 http://goo.gl/JY8hSC   Link permanente da imagem incorporada,-0.0601428571428571,-1.263,0.013095238095238,0.2749999999999999,-0.0744761904761904,-1.564,-0.0669523809523809,-1.406,0.0699047619047619,1.468,0.0
Quero um notebook da Dell ou HP .. 1Tera de memoria.. Uns 500 RAM.. Processador Intel Core. I5. Ah E placa de video pfvr. Obrigada de nda :3,0.0278181818181818,0.918,-0.0853636363636363,-2.817,0.0463636363636363,1.5299999999999998,0.0551212121212121,1.819,0.0004848484848484,0.016,0.0
Gostei de um vídeo @YouTube de @btomazelli http://youtu.be/d0ijLb7nTg4?a  Recomendação de notebook para uso básico Notebook Dell Inspiron,0.1028888888888888,1.852,-0.1539444444444444,-2.771,0.1397777777777777,2.516,0.1377777777777778,2.4800000000000004,0.0,0.0,0.0
até hoje os sites que normalmente funcionam vc procurar drivers com modelo pra notebook/pc são da Dell e Samsung,0.0263809523809523,0.554,-0.0683809523809523,-1.436,0.0551428571428571,1.158,0.0406666666666666,0.854,0.0352380952380952,0.74,0.0
Notebook 2 em 1 Dell Inspiron 13-7347-A20 http://bit.ly/1yFSPMz   Link permanente da imagem incorporada,-0.0956428571428571,-1.339,0.0123571428571428,0.173,-0.1117142857142857,-1.564,-0.1042857142857142,-1.46,0.1037142857142857,1.452,0.0
Alguns indicam a @Dell outros a @samsung mas qual notebook devo comprar???,-0.0478,-0.7170000000000001,0.0081333333333333,0.122,-0.05,-0.75,-0.0322666666666666,-0.484,0.0132666666666666,0.199,0.0
"Notebook dell inspiron tela touch 15.6"" 16gb ram 2gb video 1tb hd win 8.1: Ainda na garantia, menos de um ano de... http://fb.me/7zV8f1fHW",-0.0120666666666666,-0.362,-0.0626,-1.878,0.023,0.69,0.0158333333333333,0.4750000000000001,-0.0306333333333333,-0.919,0.0
Mainha ta de Ipad Air 2 e eu nesse notebook da Dell que já tem 20 anos,0.0767647058823529,1.3050000000000002,-0.0954705882352941,-1.623,0.0907058823529411,1.5419999999999998,0.0876470588235294,1.49,0.0,0.0,0.0
Notebook 2 em 1 Dell Série 7000 em oferta na loja Ricardo Eletro http://quenotebookcomprar.com.br/notebook-2-em-1-dell-serie-7000-em-oferta-na-loja-ricardo-eletro/ …,0.077,1.155,-0.0259999999999999,-0.3899999999999999,0.0659333333333333,0.989,0.0688666666666666,1.033,-0.0189333333333333,-0.284,0.0
"@rafabarbosa Ultrabook dá Dell não Ultrabook, é um monstro como todo notebook. Viaja no peso nas especificações! :s Eu curti um da LG.. :x",-0.0539310344827586,-1.564,0.0077931034482758,0.226,-0.1001724137931034,-2.905,-0.055103448275862,-1.598,-0.0190344827586206,-0.552,1.0
"@Dann_Cardoso o foda é que o ultrabook que eu vi da Dell aqui, que vale a pena comprar, custa o DOBRO de um notebook top de linha =(",0.0636666666666666,1.91,-0.0706666666666666,-2.12,0.0532,1.596,0.0823666666666666,2.471,0.0,0.0,1.0
"juntando isso aos preços atuais da dell, acho que vou ficar o resto da vida com esse notebook, porque olha..",0.0005652173913043,0.013,0.0521739130434782,1.2,-0.0278260869565217,-0.64,-0.0168260869565217,-0.3869999999999998,-0.0111739130434782,-0.257,1.0
Bixa eu n sei se compro notebook da Dell ou da HP! '-',0.0,0.0,0.0,0.0,0.0,0.0,0.0,0.0,0.0,0.0,0.0
Ofertas em Notebooks DELL http://migre.me/oEfq1  + Cupom de Desconto: RCA-27231,0.12325,1.479,-0.0505833333333333,-0.607,0.2259166666666666,2.7110000000000003,0.1853333333333333,2.224,0.0,0.0,0.0
Gostei de um vídeo @YouTube http://youtu.be/lq68jIy0JOs?aAprenda … a limpar seu notebook Dell,-0.0159999999999999,-0.1919999999999999,-0.0810833333333333,-0.973,0.0696666666666666,0.836,0.045,0.54,0.0,0.0,0.0
"Dell Latitude E5500 15.4"" Notebook http://gekoo.co/buy/01/?query=111635282361 …  Link permanente da imagem incorporada",-0.0956428571428571,-1.339,0.0123571428571428,0.173,-0.1117142857142857,-1.564,-0.1042857142857142,-1.46,0.1037142857142857,1.452,0.0
"Confira da ofertas de submarino: will_fsouza, recomendamos este >>> http://scup.it/8c62",0.0317857142857142,0.445,-0.0694999999999999,-0.973,0.06,0.84,0.0537857142857142,0.753,0.0,0.0,0.0
"@fabioandersonf Vemk http://pingu.im/1yvMjrG  e http://pingu.im/1yvMjrI  . No outro não consigo, pois ele não é vendido e entregue por nós.",0.0400434782608695,0.921,0.040391304347826,0.929,0.0,0.0,0.0268260869565217,0.617,0.0,0.0,0.0
"[VENDO] o DELL ja foi, só falta o Samsung :v /",-0.1153333333333333,-1.73,0.0,0.0,-0.0854666666666666,-1.282,-0.1054666666666666,-1.582,0.1156,1.734,0.0
uma dica pra vida: nunca comprem notebook da Dell e nem paguem garantia estendida. @DellAjuda @DellnoBrasil @DellAjudaPRO,0.0444736842105263,0.845,0.0506315789473684,0.962,0.0522631578947368,0.993,0.0491052631578947,0.933,0.0,0.0,1.0
Descubra como aumentar a vida útil da bateria de seu notebook Dell  :) - http://dell.to/1urulJl   Ver foto,0.1113157894736842,2.115,0.0761578947368421,1.4470000000000005,0.1452105263157894,2.759,0.1408421052631579,2.676,-0.012578947368421,-0.239,0.0
Confira o Especial Notebook Dell na loja Fast Shop aqui http://quenotebookcomprar.com.br/confira-o-especial-notebook-dell-na-loja-fast-shop-aqui/ …,0.0893333333333333,1.072,0.0875,1.05,0.0084166666666666,0.101,0.06175,0.741,0.0,0.0,0.0
"Moderno e avançado em tecnologia, conheça esse notebook da Dell.... http://fb.me/3GwXXyiuJ",0.0126923076923076,0.165,0.011076923076923,0.144,0.0063846153846153,0.083,0.0088461538461538,0.115,-0.0036923076923076,-0.048,0.0
"E aqui em casa mesmo fez a troca por uma placa novinha. E tenho meu notebook inteirinho, intacto e normal novamente ? Entao, valeu @Dell!",0.0207241379310344,0.601,0.0123793103448275,0.359,-0.0017241379310344,-0.05,0.0101724137931034,0.295,-0.0055862068965517,-0.1619999999999999,1.0
Tire tooodas as suas dúvidas sobre a bateria de seu notebook Dell - http://dell.to/1vy578U   Ver foto,0.0446470588235294,0.7590000000000001,-0.0497058823529411,-0.845,0.0495294117647058,0.842,0.0507058823529411,0.8620000000000001,-0.0068823529411764,-0.117,0.0
"Notebook Dell Inspiron I14-3442-A10 com Intel® Core™ i3-4005U, 4GB, 1TB, Gravador de DVD, Leitor... http://fb.me/7sPmRaal6",0.0215416666666666,0.517,-0.0405416666666666,-0.973,0.0349999999999999,0.84,0.032375,0.777,0.0,0.0,0.0
nossa como odeio esse notebook sdds o meu da dell não sei oq meu pai arrumou com ele,0.0,0.0,0.0,0.0,0.0,0.0,0.0,0.0,0.0,0.0,1.0
galera tenho um notebook dell e estou com problemas para instalar o driver de rede wifi nele... Já instalei tudo... http://fb.me/4lfwb27DM,0.0003478260869565,0.008,-0.0365652173913043,-0.841,-0.0040869565217391,-0.094,0.0132173913043478,0.304,0.001391304347826,0.032,0.0
Gostei de um vídeo do @YouTube http://youtu.be/GkzAbK5mDqc?a  The Dell XPS 13 Notebook Review - Broadwell and Battery Life,-0.0101052631578947,-0.1919999999999999,-0.0512105263157894,-0.973,-0.0078947368421052,-0.15,0.0111052631578947,0.211,0.0,0.0,0.0
#SALDÃOKADRI - Notebook Dell Inspiron I14-3442-A10 Core i3 1.9GHz 4GB 1TB Windows 8.1: Confira o Menor Preço  Link permanente da imagem incorporada,-0.0841111111111111,-2.271,0.0124814814814814,0.3369999999999999,-0.0917777777777777,-2.478,-0.0838148148148148,-2.263,0.0268148148148148,0.7240000000000001,0.0
Especialistas em Notebook Dell HP Sony Vaio Acer Referencia Nacional - Especialista Em Notebook... http://fb.me/3Z9oQ3X8U,0.0,0.0,0.0,0.0,0.0,0.0,0.0,0.0,0.0,0.0,0.0
"#promoção #promobit Notebook 2 em 1 Dell Inspiron 13-7347-A20 Intel Core i5 4GB (1GB Memória Dedicad http://www.promobit.com.br/Promocoes/ver-promocoes/13271/ … - R$ 2.199,12",0.0275384615384615,0.716,0.013,0.3379999999999999,0.0682692307692307,1.775,0.049076923076923,1.2759999999999998,0.0,0.0,0.0
notebook tem q ser dell memo né mano num tem jeito,0.1512727272727272,1.664,-0.1273636363636363,-1.401,0.1370909090909091,1.508,0.1385454545454545,1.524,0.0,0.0,1.0
"@iPhellipe Olá, PONTIA! Veja o valor que consigo: http://pingu.im/1FRdXan  =)",0.1197142857142857,1.6760000000000002,0.0512142857142857,0.717,0.0525714285714285,0.736,0.0745,1.043,0.0,0.0,0.0
"Meu irmão quer trocar de notebook comigo, o meu é Dell e o dele Itautec, pouco ligeiro ne? Hahah",0.0751363636363636,1.653,-0.0683181818181818,-1.503,0.0736363636363636,1.62,0.0779545454545454,1.715,-0.0077272727272727,-0.17,0.0
Ofertas em Notebooks DELL http://migre.me/oEfq1  + Cupom de Desconto: RCA-27231,0.12325,1.479,-0.0505833333333333,-0.607,0.2259166666666666,2.7110000000000003,0.1853333333333333,2.224,0.0,0.0,0.0
"Aos 34 anos de idade, conquisto meu 1° Notebook! Dell Inspirion 14 - 3.000 Series @ Parque Dos Anjos https://instagram.com/p/0tSb8OwPCL/",0.0224782608695652,0.517,-0.0423043478260869,-0.973,0.0325217391304347,0.748,0.031695652173913,0.729,0.0022173913043478,0.051,0.0
"@rodrigopfvr    Olá, Poatardi! Opa, vemk http://pingu.im/1HOPhwi  ;)",0.0759166666666666,0.911,0.0,0.0,0.0613333333333333,0.736,0.04575,0.549,0.0,0.0,0.0
PREÇÃO! Notebook Dell que vira a tela promete virar sua cabeça também! Corre que ainda tem! >http://zoom.do/1CRGPNq   Link permanente da imagem incorporada,-0.078037037037037,-2.107,-0.0151481481481481,-0.4090000000000001,-0.0299629629629629,-0.8089999999999999,-0.0651481481481481,-1.759,-0.0055185185185185,-0.149,0.0
vendo notebook @Dell R$200 novo porem o scroll do touch pad parou de funcionar,-0.0105333333333333,-0.158,-0.0534666666666666,-0.8019999999999999,0.0098666666666666,0.148,0.0048,0.072,0.0471333333333333,0.707,0.0
"O Inspiron Série 5000 é o #notebook do Ninja Noturno, que trabalha melhor à noite. Vc é assim? http://del.ly/60142oLe   Ver foto",0.0514230769230769,1.3370000000000002,-0.0244230769230769,-0.6349999999999999,0.0412307692307692,1.072,0.0433846153846153,1.128,-0.0044230769230769,-0.115,0.0
O Notebook Dell Inspiron 14 3442 A30 Ideal para tarefas cotidianas  Link permanente da imagem incorporada,-0.062,-1.054,0.0225294117647058,0.383,-0.0879411764705882,-1.495,-0.0761176470588235,-1.294,0.0814705882352941,1.385,0.0
Gostei de um vídeo @YouTube de @kakaroto_blast http://youtu.be/uXoR-pNgkHc?a  Desmontando Notebook Dell Inspiron 15R Special Edition 7520,0.0191176470588235,0.325,-0.1144705882352941,-1.946,0.0405882352941176,0.69,0.0581176470588235,0.988,0.0,0.0,0.0
Vendo notebook Dell Inspiron 1545 com Windows 7 e Office 2007 H&S originais. Processador Intel Core 2 Duo T6500... http://fb.me/1AXsLI3jb,-0.0368636363636363,-0.811,0.0046363636363636,0.102,-0.033590909090909,-0.739,-0.0344999999999999,-0.7589999999999999,0.0377272727272727,0.83,0.0
Notebook + mochila: uma dupla campeã! Veja as combinações imbatíveis do nosso Festival de Vantagens: http://del.ly/60122ov4,0.0644736842105263,1.225,-0.0146842105263157,-0.279,0.0905263157894736,1.72,0.0828947368421052,1.5750000000000002,0.0,0.0,0.0
#outlet #DELL #NOTEBOOK (y) Trazemos para você a linha completa de equipamentos DELL com preços incríveis<3... http://fb.me/2Xf3jdV28,0.0637391304347826,1.466,-0.0728695652173913,-1.676,0.0733043478260869,1.686,0.0765652173913043,1.761,0.0009130434782608,0.021,0.0
Novo Notebook Dell Kirara com 8 Cats Bytes de memória  Link permanente da imagem incorporada,-0.038125,-0.61,0.0130625,0.209,0.0122499999999999,0.1959999999999999,-0.0003124999999999,-0.0049999999999998,0.0840625,1.345,0.0
"O último computador q comprei, um notebook Dell, fiz questão q viesse sem Sistema Operacional, ganhei R$ 450,00 de desconto s/ Windows.",0.0138846153846153,0.3610000000000001,-0.0088461538461538,-0.2299999999999999,0.023,0.598,0.0388076923076923,1.009,0.0101153846153846,0.2629999999999999,0.0
"@kaiopfranca Opa, vemk então http://pingu.im/19ijMiw",0.0,0.0,0.0,0.0,0.0,0.0,0.0,0.0,0.0,0.0,0.0
Notebook Gamer de verdade: http://tdte.ch/1n0,0.0861666666666666,0.517,-0.1621666666666666,-0.973,0.1399999999999999,0.84,0.1295,0.777,0.0,0.0,0.0
Ofertas em Notebooks DELL http://migre.me/oEfq1  + Cupom de Desconto: RCA-27231,0.12325,1.479,-0.0505833333333333,-0.607,0.2259166666666666,2.7110000000000003,0.1853333333333333,2.224,0.0,0.0,0.0
ULTIMAS  UNIDADES NOTEBOOK DELL CI5-4210U-4GB-1TB-14LED-DVDR-UBUNTU--- 690  DOLARES INCLUIDO IVA  Link permanente da imagem incorporada,-0.0787647058823529,-1.339,0.0101764705882352,0.173,-0.092,-1.564,-0.0858823529411764,-1.46,0.0854117647058823,1.452,0.0
Notebook Dell Inspiron 15 Série 3000 por R$1634. 22% de desconto! #AteAcabar http://ateacabar.com/product/13452,0.063,1.134,-0.0472777777777777,-0.8509999999999998,0.1487777777777778,2.678,0.1210555555555555,2.1790000000000003,0.0,0.0,0.0
Resoluções para a vida: nunca comprar notebook Dell ou celular Samsung.,0.065,0.845,0.0643076923076923,0.836,0.0809999999999999,1.053,0.0765384615384615,0.995,0.0,0.0,1.0
Estamos  precisando do cabo do notebook Dell inspiron 1525- entrar em contato via in box .,-0.0755882352941176,-1.285,0.0,0.0,-0.0533529411764705,-0.907,-0.072,-1.224,0.087,1.479,0.0
