sentence,concept_aptitude_avg,concept_aptitude_sum,concept_attention_avg,concept_attention_sum,concept_pleasantness_avg,concept_pleasantness_sum,concept_polarity_avg,concept_polarity_sum,concept_sensitivity_avg,concept_sensitivity_sum,subjectivity
"Dell lança notebook novo na CES2015 por U$799, e o brasileiro continua pagando R$2500,00 no Positivo e sorrindo... http://goo.gl/xa4y7i",0.0303043478260869,0.697,0.0344782608695652,0.793,0.0315652173913043,0.726,0.0269565217391304,0.62,-0.0194782608695652,-0.448,0.0
hd do meu notebook da @dell estragou em um ano de uso. gg.,-0.0682666666666666,-1.024,-0.0648666666666666,-0.973,-0.0790666666666666,-1.186,-0.0397333333333333,-0.596,0.0304,0.456,1.0
"Comprei meu notebook da Dell e o blazer que eu tanto queria, já posso morrer feliz",0.0392941176470588,0.6679999999999999,0.0027058823529411,0.046,0.0863529411764705,1.468,0.0579999999999999,0.986,-0.050235294117647,-0.854,0.0
Dell anuncia o lançamento de novo ultrabook XPS 13: A Dell anunciou hoje durante a CES 2015 o lançamento do ul... http://bit.ly/1w02H1a,0.030375,0.729,-0.0334166666666666,-0.8019999999999999,0.0369583333333333,0.887,0.036875,0.885,-0.0044583333333333,-0.107,0.0
Meu Deu que coisa linda esse Notebook da Dell. Já quero. http://www.theverge.com/2015/1/6/7501385/dell-xps-13-2015-edition-announced-at-ces-2015 …,0.0669333333333333,1.004,0.0580666666666666,0.871,0.0597333333333333,0.896,0.0616,0.924,0.0,0.0,1.0
Dell anuncia o lançamento de novo ultrabook XPS 13 http://bit.ly/1BGWN9I,0.0728999999999999,0.729,-0.0802,-0.8019999999999999,0.0887,0.887,0.0885,0.885,-0.0107,-0.107,0.0
eu já tinha decidido não comprar um notebook aí a dell vai e anuncia esse mais fino que o mackbook air...,-0.0322272727272727,-0.709,-0.0057272727272727,-0.126,-0.0422727272727272,-0.93,-0.0229090909090909,-0.504,0.0,0.0,1.0
Nunca pensei que acharia um Notebook da Dell tão daora https://www.youtube.com/watch?v=4OwWgpNRIKc …,-0.0590833333333333,-0.709,0.0,0.0,-0.0825,-0.99,-0.0471666666666666,-0.566,0.0,0.0,1.0
"Notebook Dell Inspiron i14-5447-A10 com Intel Core i5 4GB (2GB de Memória Dedicada) 1TB LED HD 14"" Windows 8.1... http://fb.me/2jTszBtvM",0.0191481481481481,0.517,-0.005,-0.135,0.0634444444444444,1.713,0.0498888888888888,1.347,0.0,0.0,0.0
Adicionei um vídeo a uma playlist @YouTube http://youtu.be/qwQ37Rmumxc?aPeixe … Dicas - Unboxing Notebook Dell Vostro 5470 a60,-0.0417058823529411,-0.709,0.0,0.0,-0.058235294117647,-0.99,-0.0332941176470588,-0.566,0.0,0.0,0.0
Peixe Dicas - Unboxing Notebook Dell Vostro 5470 a60: http://youtu.be/qwQ37Rmumxc?a  via @YouTube,0.0164285714285714,0.2299999999999999,0.0131428571428571,0.184,-0.002,-0.028,0.0071428571428571,0.0999999999999999,-0.0060714285714285,-0.085,0.0
"Nesse exato momento o que eu quero é meu notebook da dell de novo, msm sendo velhinho é melhor q o meu da lenovo",0.0762799999999999,1.907,-0.0476399999999999,-1.1909999999999998,0.07164,1.791,0.07272,1.8180000000000005,-0.00924,-0.2309999999999999,1.0
tu olha o preço do MacBook e pensa: vou ver o preço do Dell... você ve os preços do Dell: - eu mesmo arrumo meu notebook u.u,0.0255666666666666,0.7669999999999999,0.0302333333333333,0.907,-0.0014333333333333,-0.043,0.0157666666666666,0.473,-0.0056333333333333,-0.1689999999999999,1.0
Muito legal esses travesseiros de notebook da @dell  Link permanente da imagem incorporada,-0.0505714285714285,-0.7080000000000001,0.0075714285714285,0.106,-0.0939285714285714,-1.315,-0.0517142857142857,-0.724,0.1432142857142857,2.005,1.0
"Dicas de Compras , Notebook Dell Inspiron i14-5447-A10, por R$ 1.799 http://goo.gl/azuhFm   Link permanente da imagem incorporada",-0.0432631578947368,-0.822,-0.0421052631578947,-0.8,-0.0381052631578947,-0.724,-0.0359473684210526,-0.6829999999999999,0.0764210526315789,1.452,0.0
Gostei de um vídeo @YouTube de @herbertfialho http://youtu.be/TRAbO65faPY?a  Notebook DELL Travando e Tela Azul - RESOLVIDO,0.0226470588235294,0.385,-0.1057058823529411,-1.797,0.0167647058823529,0.285,0.0483529411764706,0.8220000000000002,-0.0177647058823529,-0.302,0.0
"sem condições com esse notebook, amanhã vou ligar pra assistência da Dell vir aqui e arrumar esta bela bosta",-0.02115,-0.423,0.0013499999999999,0.0269999999999999,-0.0336999999999999,-0.6739999999999999,-0.02555,-0.511,0.0246,0.492,1.0
Breve relato: Fedora 21 no Notebook Dell Inspiron 14 2640 http://josemalcher.net/fedora-21-no-notebook-dell-inspiron-14-2640/ … #dell #fedora,0.01,0.17,0.0090588235294117,0.154,0.0,0.0,0.005235294117647,0.089,-0.0034117647058823,-0.058,0.0
"Notebook Dell Inspiron, 6GB Memória, GForce 1GB, 1TB http://belohorizonte.olx.com.br/notebook-dell-inspiron-6gb-memoria-gforce-1gb-1tb-iid-739924608 …",0.0,0.0,0.052375,0.838,0.0545625,0.873,0.035625,0.57,0.0,0.0,0.0
E como presente vou comprar um notebook da Dell pra eu mesma porque eu mereço,-0.0002,-0.003,-0.0084,-0.126,0.0014666666666666,0.022,0.0032666666666666,0.049,0.0,0.0,0.0
Vai tomar no cu dell do caralho nao aguento mais. Segundo notebook com problema no mousepad,-0.0423529411764705,-0.72,0.018,0.306,-0.0457647058823529,-0.778,-0.0455882352941176,-0.775,0.0391176470588235,0.665,1.0
Cargadores Originales Para Notebook:  -Acer -Asus -Dell -HP -Lenovo -Sony -Samsung -Toshiba -P. Bell -MAC  Link permanente da imagem incorporada,-0.0582173913043478,-1.339,0.0075217391304347,0.173,-0.068,-1.564,-0.0634782608695652,-1.46,0.0631304347826087,1.452,0.0
"tudo bem que o notebook da dell só falta vir embalado em jornal, mas o que importa é o conteúdo",0.0181904761904761,0.382,0.0639047619047619,1.342,0.0677619047619047,1.423,0.0317142857142857,0.6660000000000001,0.0329523809523809,0.6920000000000001,0.0
"Acho que vale muito a pena ultrapassar um pouco meu orçamento por um notebook que seja Dell e, especialmente, com processador i5",-0.0550833333333333,-1.3219999999999998,0.0414583333333333,0.995,-0.1071249999999999,-2.571,-0.0481249999999999,-1.1549999999999998,0.0237083333333333,0.5690000000000001,1.0
Cá estou paquerando um notebook maravilhoso da Dell que comprarei em breve.,-0.0133846153846153,-0.1739999999999999,-0.0389230769230769,-0.506,-0.0726153846153846,-0.944,-0.0092307692307692,-0.1199999999999999,-0.0044615384615384,-0.058,1.0
@DellAjuda Bom dia. Possuo um note da Dell com pacote office. Ocorre que um vírus apagou meu Office. Tem como reinstalá-lo?,0.0014,0.0350000000000001,-0.08752,-2.188,-0.0203599999999999,-0.5089999999999999,0.00976,0.244,-0.0394,-0.985,0.0
@DellnoBrasil Bom dia. Meu Dell foi infectado por um vírus e meu pacote Office q adquiri junto com o note sumiu. Tem como eu recuperá-lo?,0.0265714285714285,0.7440000000000001,-0.0781428571428571,-2.188,0.0171785714285714,0.481,0.0289285714285714,0.8099999999999999,-0.0351785714285714,-0.985,0.0
"@algumaanna @felipe_fgnds Muito. Note eu gosto da Dell, samsung e HP",0.0021538461538461,0.028,0.0,0.0,0.0086153846153846,0.1119999999999999,-0.0105384615384615,-0.137,0.0425384615384615,0.553,1.0
@cartaosubmarino estou tentando comprar um note da Dell mas não consigo aplicar o cupom que recebi por email! Não funciona!,-0.0073636363636363,-0.1620000000000001,-0.0235454545454545,-0.518,-0.027090909090909,-0.5959999999999999,-0.0126818181818181,-0.2789999999999999,0.0434090909090909,0.955,0.0
@lhlimaverde a Dell tá com um note com i3 de 4a geração com Ubuntu por pouco mais de 1400... talvez valha a pena...,0.04452,1.113,-0.04212,-1.053,0.0276,0.69,0.06192,1.548,0.0,0.0,0.0
"@Rafaael_dc po, tô nem usando quase ( dia de semana só uso o note, tô c um Dell i5 teclado iluminado um tesão) e tô na busca do carro ahahah",0.0461818181818181,1.524,-0.0764848484848484,-2.524,0.0537272727272727,1.773,0.0677272727272727,2.2350000000000008,-0.0125454545454545,-0.414,1.0
vou colocar o adesivo da apple em cima do simbolo da dell do note,-0.1201428571428571,-1.682,0.0,0.0,-0.0380714285714285,-0.533,-0.0932142857142857,-1.3050000000000002,0.1215714285714285,1.702,0.0
@MicrosoftBr A atualização do meu Win8 para o 10 (originais) NOVAMENTE danificou meu note. Quem pagará o reparo de R$ 700 da Dell?,0.0191481481481481,0.517,-0.0096666666666666,-0.261,0.057037037037037,1.54,0.0462222222222222,1.248,0.0,0.0,1.0
"@Dell @DellnoBrasil parabéns pelo péssimo serviço de Hell Desk! Etiqueta no fundo do note apaga, a culpa é do cliente que comprou com vcs?",0.0531851851851851,1.436,0.0043333333333333,0.117,0.0472592592592592,1.2759999999999998,0.0441851851851851,1.1930000000000005,-0.0421851851851851,-1.139,1.0
"Talvez trocar o note não tenha sido uma boa opção. Rodava de boa no HP, agora no Dell... dells me livre, aff!",0.088037037037037,2.377,-0.029037037037037,-0.784,0.06,1.62,0.0834074074074074,2.252,0.0,0.0,1.0
"tava lembrando aqui q meu note ja ta pra completar 3 anos, com um total de 0 defeitos até então... dell é foda viu",0.0141153846153846,0.3670000000000001,-0.0721923076923077,-1.877,0.0284230769230769,0.739,0.0382692307692307,0.995,0.0,0.0,1.0
E a porra do note da #dell estragou de novo! #delllixo #notedell #lixo,-0.0057222222222222,-0.1029999999999999,-0.0445555555555555,-0.8019999999999999,-0.0053333333333333,-0.096,0.0062222222222222,0.112,0.0221111111111111,0.398,1.0
"vou me contentar em comprar um note da samsung, depois quem sabe compro um dell e daqui 87 anos quem sabe um macbook",-0.0121249999999999,-0.2909999999999998,-0.00525,-0.126,-0.0428333333333333,-1.028,-0.0164999999999999,-0.3959999999999999,0.0,0.0,0.0
"Eu to muito triste, achei que ia ter um note novo hoje ou ia esperar um da dell chegar mas não.. Pqp so me fodo",-0.0615185185185185,-1.6609999999999998,0.0418518518518518,1.13,-0.0934814814814814,-2.524,-0.0486296296296296,-1.3129999999999995,0.0081111111111111,0.219,0.0
@oLucasNobrega @_Ravs wacon com tela ou um surface ou até esse note da dell que eu mandei,-0.0052941176470588,-0.0899999999999999,-0.0491764705882353,-0.8360000000000001,-0.0028235294117647,-0.0479999999999999,0.0153529411764705,0.2610000000000001,-0.0030588235294117,-0.052,0.0
"@paat_oliv ixi, o 5458? de 2,3k? to pensando em comprar um note da dell, mas antes to na pesquisa",0.0219565217391304,0.505,-0.0846521739130434,-1.947,0.0312608695652173,0.719,0.046,1.058,0.0,0.0,0.0
"@toniereis veja meu caso, estou com um note Dell com licença do Win 8. Só que não acho ele para baixar, somente o 8.1",-0.0472962962962962,-1.277,0.0049629629629629,0.134,-0.0623703703703703,-1.684,-0.0471851851851851,-1.274,0.0368518518518518,0.995,0.0
Que lindo note...,0.05725,0.229,0.03025,0.121,0.02275,0.091,0.03675,0.147,0.0,0.0,1.0
A Dell não está agindo de boa fé comigo. Renoveu o suporte do meu note até 2016 e depois de 30 meses exigem NF pra me atender,0.0628571428571428,1.7599999999999998,-0.1259642857142857,-3.527,0.119,3.332,0.0915714285714285,2.564,0.0332142857142857,0.93,1.0
"@fellypemax note, aconselho algo assim http://m.dell.com/mt/www.dell.com/br/p/inspiron-14-5447-laptop/pd?un_jtt_v_MPLP=yes&fl=m&un_jtt_redirect … e o preço ta ótimo",0.0044615384615384,0.058,0.0126153846153846,0.164,0.0,0.0,0.0056923076923076,0.074,0.0,0.0,0.0
"@fellypemax com certeza hahahaas cá entre nós, pego um vaio, dell ou hp por menos e muuuuuito mais potente (falando apenas do note)",-0.0028148148148148,-0.0759999999999999,0.0091481481481481,0.247,-0.0024814814814814,-0.0669999999999999,0.0147777777777777,0.399,0.0,0.0,0.0
@hey_mika É SIM! Eu tenho um note Dell e SEMPRE da problema no WiFi,-0.0004,-0.006,0.0054,0.081,-0.0180666666666666,-0.2709999999999999,-0.0071333333333333,-0.1069999999999999,-0.0084666666666666,-0.127,1.0
"Dell anda jogando pra cima (nas promos e nos preços), não há mais meio termo... só não sei se vale trocar de note ou esperar estabilizar",0.0561666666666666,1.685,-0.0243666666666666,-0.731,0.0385,1.155,0.0502,1.506,0.0332,0.996,0.0
"#PloneGov [gitec] hd externo: Pessoal,",0.0128,0.128,0.018,0.18,0.0111,0.111,0.014,0.14,0.0,0.0,0.0
alguém troca um celular pelo note da dell novinho ?,-0.0416,-0.416,0.0215,0.215,-0.104,-1.04,-0.0442999999999999,-0.4429999999999999,-0.0089,-0.089,0.0
"Como meu note tá nas últimas, acho que vou comprar aquele Dell Vostro com Ubuntu que tá no site deles antes que o W10 termine com ele.",0.0,0.0,-0.0043448275862068,-0.126,0.0020689655172413,0.06,0.0021379310344827,0.062,0.0,0.0,0.0
"Eu me lembro de ter visto um Dell pra ela, na época. Dell é tão amor, quando for comprar meu note vou querer um com certeza",0.0229310344827586,0.6650000000000001,0.0241724137931034,0.7009999999999998,0.0204482758620689,0.5930000000000002,0.0559310344827586,1.622,-0.0113448275862068,-0.329,1.0
"@stormqueen1990 é esse aqui, acho que é note http://dell.to/1NIHIO4",0.0,0.0,0.0,0.0,0.0,0.0,0.0,0.0,0.0,0.0,0.0
Note novo da dell ?,0.0424,0.212,0.0342,0.171,0.0094,0.047,0.0216,0.108,-0.0214,-0.107,0.0
"Preciso mesmo é um note Dell, esse comprarei.",-0.0303999999999999,-0.3039999999999999,0.0325,0.325,-0.099,-0.99,-0.0346999999999999,-0.347,-0.0072999999999999,-0.073,1.0
"@vazio_ cara, meus 5 anos com o note da dell, nada a reclamar... dessa vez não é problema na dell, vi gente reclamando msm com placa antiga",-0.03003125,-0.961,-0.0131562499999999,-0.4209999999999999,-0.002875,-0.092,-0.0247812499999999,-0.7929999999999998,0.056625,1.812,1.0
Pc nada... pelo note mais velho q ja usei... Dell Latitude .-.,-0.0228666666666666,-0.3429999999999999,-0.0427333333333333,-0.641,-0.0036666666666666,-0.0549999999999999,-0.0164,-0.246,0.0654,0.981,0.0
"O note que eu tinha dito que estou vendendo, aqui tem todas as configurações e detalhes, inbox mais detalhes e... http://fb.me/2Zoc3o9uB",0.0328333333333333,0.788,-0.0270833333333333,-0.65,0.0292499999999999,0.702,0.0297083333333333,0.713,0.0,0.0,0.0
Novo note da Dell. O que você acha? http://fb.me/82DMGdyhG,0.0192727272727272,0.212,0.0155454545454545,0.171,0.0042727272727272,0.047,0.0098181818181818,0.108,-0.0097272727272727,-0.107,0.0
Gente to vendendo um Note da Dell..alguém se interessa ou conhece alguém interessado?,0.0088125,0.141,0.0,0.0,-0.0051249999999999,-0.0819999999999999,0.00125,0.02,0.0,0.0,0.0
Per la prima volta riguardo le mie foto del concerto e inizio a sentire le note dell'essenziale alla tv e bom ! @mengonimarco manchi troppo♥,0.0036153846153846,0.094,0.0045,0.117,0.0,0.0,0.0017307692307692,0.045,-0.0029615384615384,-0.077,0.0
"Dell me surpreendeu no suporte, tô com meu note funcionando já. Que belezura.",0.0590625,0.945,-0.0423125,-0.677,0.0476875,0.763,0.0496875,0.795,0.0,0.0,1.0
vou ter que chamar o técnico da Dell pq a tela do note ta com uma pintinha aff e eu que ja comprei logo a dell pq pensei nao dar problema,0.0084516129032258,0.262,0.0128709677419354,0.399,-0.0056774193548387,-0.176,0.0008387096774193,0.0259999999999999,-0.0130967741935483,-0.406,1.0
"@MicrosoftAjuda mas o meu note é novíssimo da dell, se eu desligar pode dar problema?",0.0583529411764705,0.992,-0.0261764705882352,-0.445,0.0289999999999999,0.4929999999999999,0.0385294117647058,0.655,-0.0074705882352941,-0.127,0.0
"@DellnoBrasil bom dia,a imagem de fábrica q vem no meu note ñ está funcionando e preciso de um dvd c\a imagem de fábrica.Na minha conta Dell",0.0083,0.2490000000000001,-0.1140333333333333,-3.421,0.0254333333333333,0.763,0.0378333333333333,1.1350000000000002,0.0419333333333333,1.258,0.0
Eu tenho um note antigo da hp aq que tem uns 5 anos e ainda funciona blz. Só é lento. Aí o Dell me apronta uma dessas.,-0.0222666666666666,-0.6679999999999999,-0.0216666666666666,-0.65,-0.0333666666666666,-1.001,-0.0282333333333333,-0.847,-0.0506999999999999,-1.521,1.0
"Meu note novo até que é amorzinho, mas como desapegar do antigo? #QuemTemNãoTroca #Dell",0.0428333333333333,0.771,-0.0407222222222222,-0.733,0.052,0.936,0.0495555555555555,0.892,-0.0059444444444444,-0.107,1.0
Problemas com a bateria de seu note Dell? Confira nossas dicas ✅ - http://dell.to/1uqUubB,0.0378666666666666,0.5680000000000001,-0.0648666666666666,-0.973,0.059,0.885,0.0539333333333333,0.809,0.0,0.0,0.0
Você não pode perder! Super dicas para melhorar a vida útil da bateria do seu note Dell ? - http://dell.to/1urulJl,0.0118095238095238,0.2479999999999999,0.0182380952380952,0.3829999999999999,0.0427619047619047,0.898,0.0296190476190476,0.6220000000000001,0.0466666666666666,0.98,0.0
Só confirmando... #Dell nunca mais! #jaeras o note https://instagram.com/p/6mr4iotwgC/,0.0,0.0,0.0,0.0,0.0,0.0,0.0,0.0,0.0,0.0,1.0
"@vieiracamila, pior eu que tenho o meu celular com Android e meu note @Dell, com menos de 1 ano de uso, mas já os odeio tanto todo dia.",0.05403125,1.729,-0.08,-2.56,0.07209375,2.307,0.06725,2.152,-0.00446875,-0.143,1.0
Onde eu tava com a cabeça pra comprar esse note ostentação da dell? Vou vender meu rim pra pagar,-0.0137999999999999,-0.2759999999999999,0.01915,0.383,-0.04525,-0.905,-0.0289,-0.578,0.03435,0.687,0.0
"Tô gostando das primeiras impressões do Windows 10. Interface suave, ícones menos complexos e parece que toda mais leve no meu note Dell. ??",0.02375,0.665,0.0,0.0,0.0334285714285714,0.936,0.0190714285714285,0.5339999999999999,0.0,0.0,0.0
Mas meu note começando a ser frango nos traves da vida e olha q é Dell a marca maravilha q todo o ser vivente me indicou e eu comprei,0.0388275862068965,1.126,0.0198275862068965,0.575,0.0380689655172413,1.104,0.0400689655172413,1.162,-0.0032758620689655,-0.095,1.0
"Acho que na próxima vez que for comprar um note eu cruzo a fronteira, mas não compro mais com a Dell. Que bagunça...",-0.0608846153846153,-1.583,-0.0048461538461538,-0.126,-0.0357692307692307,-0.93,-0.0417307692307692,-1.085,0.0334615384615384,0.87,1.0
@ruisantoos como a @Dell sabe que eu sou fresco e sempre vacila pra entregar meu note?,0.0252941176470588,0.43,0.0271764705882352,0.4619999999999999,0.0576470588235294,0.98,0.0164705882352941,0.28,0.0247647058823529,0.421,1.0
"@weullers já vou aproveitar e engatar um pedido: uma amiga ta querendo um note 15'. Quais marcas além de Acer, HP e Dell eu posso indicar.",-0.0228064516129032,-0.7069999999999999,-0.0265806451612903,-0.824,-0.0367741935483871,-1.14,-0.0079354838709677,-0.2459999999999998,0.0004838709677419,0.015,0.0
E por último um note da Dell Red ??????,-0.0394285714285714,-0.5519999999999999,0.0108571428571428,0.152,-0.0679285714285714,-0.951,-0.0321428571428571,-0.4499999999999999,0.0,0.0,1.0
Um note de 18 meses com 4GB de memória não suporta 1 firefox e 2 planilhas.Como vou trabalhar dessa forma? @DellAjudaPRO @Dell @MichaelDell,0.028037037037037,0.7570000000000001,-0.0245555555555555,-0.6630000000000001,0.0721481481481481,1.948,0.0692222222222222,1.869,-0.0121481481481481,-0.328,1.0
Descaso total da @dell @DellAjudaPRO @MichaelDell comigo. Paguei o NOTE a vista! E ainda solicitei assistência residencial. Nunca vieram,-0.0003636363636363,-0.008,-0.0263636363636363,-0.58,0.0326818181818181,0.719,0.0071363636363636,0.157,-0.0371818181818181,-0.818,1.0
@fabiohara Hara desculpe incomoda-lo... tenho um note dell e após atualizar para windows 10 ele simplesmente não liga!! modelo inspiron 14z,0.03275,0.786,-0.0596666666666666,-1.432,0.0247916666666666,0.595,0.0388333333333333,0.932,0.0007083333333333,0.017,1.0
"Vejo muito chupa rola de Dell pqp, não é pq teu note e da Dell que ele vai ser bom. Ainda mais Inspiron, malz ai",-0.0404285714285714,-1.132,-0.0402857142857142,-1.128,0.0029999999999999,0.0839999999999999,-0.0168571428571428,-0.472,-0.0139642857142857,-0.3909999999999999,1.0
descobri num fórum da dell q a BIOS do meu note tava desatualizada dai atualizei e agora tá #indo eu acho,0.0442272727272727,0.973,0.0482272727272727,1.061,0.0,0.0,0.0299090909090909,0.658,-0.0026818181818181,-0.059,0.0
Reparo efetuado em notebook Dell modelo: Inspiron 5420 com LCD danificado. Seu micro/note(o)book apresenta alguma... http://fb.me/3kayR5p4Z,-0.0014761904761904,-0.031,-0.0289999999999999,-0.609,0.011095238095238,0.2329999999999999,0.002095238095238,0.0439999999999999,0.0323809523809523,0.68,0.0
"Atendimento porco! Não recomendo a @Dell pra ninguém mais! Decepcionado! Precisando urgente do meu note, comprometendo meu trabalho...putz",-0.0388333333333333,-0.932,-0.036,-0.864,0.013,0.312,-0.0190833333333333,-0.4580000000000001,-0.0747916666666666,-1.7950000000000002,1.0
@rocketzbr pode me ajudar? É da dell o note,0.074,0.74,0.0,0.0,0.0854,0.854,0.0531,0.531,0.0,0.0,0.0
"to com note Dell Inspiron com 2 anos de uso, i5, 4GB 1TB! Só o drive de cd/dvd q pifou! Ta funcionando bem, será q rola de vender barato",0.0895,3.401,-0.0216315789473684,-0.8220000000000001,0.1085526315789473,4.125,0.1087105263157894,4.131,-0.0039473684210526,-0.15,0.0
"é incrível, mas tô no site da Dell e cheguei na conclusão de que não vale a pena MESMO investir em PC. tem que ir pro note.",0.1407666666666666,4.223000000000001,-0.0580333333333333,-1.741,0.1062,3.186,0.1334666666666666,4.004,-0.0079666666666666,-0.239,0.0
3500$ o Dell i7 5 geracao sla mais oq e ainda touch e meu pai disse que o cara tava querendo dms no note,-0.00032,-0.008,-0.0232,-0.58,0.0287599999999999,0.719,0.00628,0.157,-0.03272,-0.818,0.0
"Muito satisfeito com o note da dell aqui, é demais! @DellnoBrasil",-0.0003846153846153,-0.005,0.0563076923076923,0.732,0.0246923076923076,0.321,0.0126923076923076,0.165,0.0425384615384615,0.553,1.0
"eu achava que a placa de video do meu note era super bosta, mas é dell e roda muita coisa nele",0.0332727272727272,0.7320000000000001,-0.0427727272727272,-0.941,0.0405454545454545,0.892,0.0421363636363636,0.927,0.002,0.044,1.0
"Comprarei o note no site da DELL mesmo, sou muito desconfiada com internet. E no site da DELL o frete é grátis.",-0.05124,-1.281,0.00852,0.213,-0.0236399999999999,-0.591,-0.04316,-1.0790000000000002,0.05348,1.3370000000000002,0.0
"Resumo da atualização p/ #Windows10 : Um note Dell novo deu tudo certo, e outro note Dell com 4 anos de uso o microfone parou de focionar.",0.0568333333333333,1.705,0.0013333333333333,0.0399999999999999,0.0497666666666666,1.493,0.0772,2.3160000000000003,-0.0062666666666666,-0.188,0.0
"@moby_vmg Dell é top, ponta firme em qqr problema que você tiver, tem uma assistência eficiente e rápida, acho uma ótima marca! NOTE TOP *-*",0.0608387096774193,1.886,0.0062903225806451,0.1949999999999999,0.0470645161290322,1.459,0.0531935483870967,1.649,-0.0058064516129032,-0.18,1.0
@gretamenchi #DragMeDown e mo chi ce le canta le note dell'iperuranio ?!,0.0,0.0,0.0,0.0,0.0,0.0,0.0,0.0,0.0,0.0,0.0
"@h1ghlysensitive @Amorim_Joseph_ Eu comprei tudo pelo mercado livre, nada de loja montada pfv... aah não ser que seja tipo um note da Dell",-0.0206538461538461,-0.5369999999999999,-0.0264615384615384,-0.688,-0.017576923076923,-0.4569999999999999,-0.0171153846153846,-0.4449999999999999,0.0631538461538461,1.642,0.0
"Atualizando o meu note, de Windows 7 para Windows 10 #upgrade #windows10 #dell #like #sunday ???✔… https://instagram.com/p/5456UPp2bF/",0.0191481481481481,0.517,-0.036037037037037,-0.973,0.0311111111111111,0.84,0.0287777777777777,0.777,0.0,0.0,0.0
"Fiz update num note antigo da dell, tudo funcionando perfeitamente, inslaei o suport assist, a dell me informa que não recomenta o update+",0.0095,0.247,0.0066923076923076,0.174,0.0021538461538461,0.056,0.005076923076923,0.132,-0.0031153846153846,-0.081,0.0
@telmachristiane esse foi o meu primeiro note Dell. Não foi uma experiência muito boa. Tenho um outro Acer que nunca deu problema.,0.01648,0.412,0.07244,1.811,-0.03144,-0.786,0.01012,0.253,0.01704,0.426,1.0
Mas eu to surpreso. Esse note da Dell tinha um monte de problema com driver no Windows 8. Parece que agora posso atualizar eles sem medo.,0.0096206896551724,0.2790000000000001,-0.0103793103448275,-0.3009999999999999,-0.0330689655172413,-0.959,0.0043103448275862,0.1250000000000001,-0.0214482758620689,-0.6220000000000001,1.0
"@marllonaguiar olá, meu note é @dell, por isso achei o driver lá. Tenta no site da acer, pesquisar driver audio acer e o modelo do seu note",0.0460967741935483,1.4289999999999998,-0.0196451612903225,-0.609,0.0508387096774193,1.576,0.0388709677419354,1.205,0.0,0.0,0.0
@hengsf tive que voltar pro w8.1 pois tava dando alguma incompatibilidade no meu note dell e não deixava conectar a internet.,0.0490454545454545,1.0790000000000002,0.057090909090909,1.256,0.0249090909090909,0.548,0.0385,0.847,-0.015590909090909,-0.343,0.0
"@DellAjuda Tenho um Note Dell W8.1 quando tento atualizar para W10 ele pede a senha... se não me engano vem embutido na placa, oque fazer?",-0.0087499999999999,-0.245,-0.0106071428571428,-0.297,-0.0303214285714285,-0.8489999999999999,-0.0077857142857142,-0.2179999999999999,0.0184285714285714,0.516,0.0
Alegria com o Win10 no note > Vejo q nao consigo mais ajustar o brilho da tela > descubro que a Dell não atualizou todos drivers > fudeo,-0.0135357142857142,-0.379,0.0281785714285714,0.7889999999999999,-0.0028214285714285,-0.079,-0.0089642857142857,-0.251,0.00525,0.147,1.0
"@Leolivl miga, esqueceu que meu note é novo e da dell? atualizou sozinho seu besta!",0.0117777777777777,0.212,0.0095,0.171,-0.0423888888888888,-0.763,-0.0256666666666666,-0.4619999999999999,-0.056,-1.008,0.0
@enzo_dicarlo CARA SEU NOTE EH UM DELL COM I5 A PLACA É UMA GT720 E TEM 8GB DE RAM????,0.055625,1.335,-0.0917916666666666,-2.203,0.0529583333333333,1.271,0.0667916666666666,1.6030000000000002,0.0,0.0,0.0
@ClaudioPeixoto_ pode tirar uma dúvida aqui? Tenho um Note Dell e estou conectando uma mesa no canal de microfone (in) e (out) nas caixihas,-0.0186333333333333,-0.559,-0.0414,-1.242,-0.0370333333333333,-1.1110000000000002,-0.0015666666666666,-0.047,-0.0149666666666666,-0.449,0.0
A @Dell se recusou a prestar suporte do meu note pois atualizei meu Windows para o 10 com a chave fornecida por eles mesmos! Que escroto!,0.0427857142857142,1.198,-0.0116428571428571,-0.326,0.0251785714285714,0.705,0.0326785714285714,0.915,-0.0051428571428571,-0.144,1.0
