sentence,concept_aptitude_avg,concept_aptitude_sum,concept_attention_avg,concept_attention_sum,concept_pleasantness_avg,concept_pleasantness_sum,concept_polarity_avg,concept_polarity_sum,concept_sensitivity_avg,concept_sensitivity_sum,subjectivity
Notebooks Dell! Tecnologia poderosa sempre com você http://migre.me/qmD4L  + Cupom de Desconto: RCA-27231,0.10275,1.644,-0.0289374999999999,-0.4629999999999998,0.1746249999999999,2.794,0.1461875,2.339,-0.003,-0.048,0.0
Cargadores Originales Para Notebook:  -Acer -Asus -Dell -HP -Lenovo -Sony -Samsung -Toshiba -P. Bell -MAC  Link permanente da imagem incorporada,-0.0582173913043478,-1.339,0.0075217391304347,0.173,-0.068,-1.564,-0.0634782608695652,-1.46,0.0631304347826087,1.452,0.0
"Pessoas feicebuquianas,",0.0,0.0,0.0,0.0,0.0,0.0,0.0,0.0,0.0,0.0,0.0
Dá uma olhada nessa reclamação contra Dell Computadores do Brasil no @ReclameAQUI - ... http://www.reclameaqui.com.br/13724177/dell-computadores-do-brasil/notebook/ …,-0.0073125,-0.117,0.004875,0.078,-0.0131875,-0.211,-0.00825,-0.132,-0.009125,-0.146,1.0
Ofertas em Notebooks DELL http://migre.me/oEfq1  + Cupom de Desconto: RCA-27231,0.12325,1.479,-0.0505833333333333,-0.607,0.2259166666666666,2.7110000000000003,0.1853333333333333,2.224,0.0,0.0,0.0
Compre um notebook Dell e leve um game para PC! Consulte modelos e jogos participantes em uma de nossas lojas! Promoção por tempo limitado!,-0.0005555555555555,-0.0149999999999999,-0.0177777777777777,-0.48,0.0235555555555555,0.636,0.0386296296296296,1.043,0.0011111111111111,0.0299999999999999,0.0
Sonho: notebook da Dell Realidade: PC quebrado,-0.0874444444444444,-0.7869999999999999,0.0,0.0,-0.1788888888888888,-1.61,-0.1483333333333333,-1.335,0.0037777777777777,0.0339999999999999,1.0
Notebook Dell Inspiron 14 Intel Core i5 4GB HD 1TB em Colombo  Vendo: R$ 1450.00 Tratar com: Mayra http://colombo.desapega.net/notebook-dell-inspiron-14-intel-core-i5-4gb-hd-1tb--pid-13683 …,-0.05712,-1.428,0.0,0.0,-0.0692,-1.73,-0.06396,-1.599,0.06564,1.641,0.0
http://www.submarino.com.br/produto/120612351/notebook-dell-inspiron-i14-5447-a20-com-intel-core-i5-8gb-2gb-de-memoria-dedicada-1tb-led-hd-14-touchscreen-windows-8.1?opn=FACEBOOKADS&epar=sa_au_00_fb_4294dyn … meu sonho de consumo atualmente,0.0628571428571428,0.44,-0.1389999999999999,-0.973,0.12,0.84,0.1072857142857142,0.751,0.0,0.0,0.0
"tô há 35 minutos conversando por telefone com o técnico da Dell, procurando uma solução para o meu finado notebook",0.0047142857142857,0.099,0.0055238095238095,0.1159999999999999,-9.523809523809532e-05,-0.002,0.0022857142857142,0.048,0.0064285714285714,0.135,1.0
Notebooks Dell! Tecnologia poderosa sempre com você http://migre.me/qmD4L  + Cupom de Desconto: RCA-27231,0.10275,1.644,-0.0289374999999999,-0.4629999999999998,0.1746249999999999,2.794,0.1461875,2.339,-0.003,-0.048,0.0
"Reclame Aqui - Dell Computadores do Brasil - garantia de notebook, já e a quarta vez MEU DEUS http://fb.me/47HRRfSEJ",0.02585,0.517,-0.04865,-0.973,0.0419999999999999,0.84,0.03885,0.777,0.0,0.0,1.0
"Tenho um notebook de última geração, porém não tem entrada pra CD, essa Dell pensa que sou rica pra ficar comprando programas caríssimos ??",0.0255925925925925,0.6910000000000001,-0.0569999999999999,-1.539,-0.0318518518518518,-0.86,-0.0029999999999999,-0.0809999999999999,-0.0077407407407407,-0.209,1.0
Performance de Notebook. Mobilidade de Tablet http://migre.me/pVRcE  + Cupom de Desconto: RCA-27231,0.1771333333333333,2.657,-0.1702,-2.553,0.2927333333333333,4.391,0.2550666666666666,3.826,0.0,0.0,0.0
coisa chata essa parada de trabalhar e não conseguir comprar um notebook da dell i7core :(,0.01025,0.164,-0.047625,-0.762,0.015375,0.246,0.0365,0.5840000000000002,-0.0060625,-0.097,0.0
Dell Inspiron 3551 Notebook (Pentium Quad Core N3540/ 2GB/ 500GB/ DOS) (35402500IBU) Rs.19397... http://fb.me/2n8bjYGcI,0.0,0.0,0.0,0.0,0.0,0.0,0.0,0.0,0.0,0.0,0.0
"Notebook Dell Inspiron. de R$ 2.499,00 por R$ 2.099,00 em até 10x de R$ 209,90 sem juros no cartão de crédito ou... http://fb.me/3IgTz5Fp3",0.05964,1.491,-0.19276,-4.819,0.13548,3.387,0.12152,3.0380000000000003,0.02336,0.584,0.0
"Amigos, tive que comprar outro notebook. Coitadinho do antigo, teve uma morte horrível com vários CIs em curto. RIP DELL inspiron.",-0.016076923076923,-0.418,0.0386538461538461,1.005,-0.0264615384615384,-0.6880000000000001,-0.0193461538461538,-0.5029999999999999,0.0549615384615384,1.429,0.0
Melhores marcas de notebook sem ser Dell e Asus? Alguém ajuda!,-0.0078461538461538,-0.1019999999999999,-0.0826153846153846,-1.074,-0.0038461538461538,-0.05,0.0086923076923076,0.113,0.0449230769230769,0.584,0.0
"Que saudades do meu notebook da HP, esse Dell é uma bosta, que sacoooooo",0.0,0.0,0.0,0.0,0.0,0.0,0.0,0.0,0.0,0.0,1.0
roubar um notebook dell de 4 mil conto e um carregador motorola QUE FASE HEIN LADRÃOZINHO,-0.1111875,-1.779,-0.0608125,-0.973,-0.1225,-1.96,-0.0774374999999999,-1.239,0.0595625,0.953,0.0
Ofertas em Notebooks DELL http://migre.me/oEfq1  + Cupom de Desconto: RCA-27231,0.12325,1.479,-0.0505833333333333,-0.607,0.2259166666666666,2.7110000000000003,0.1853333333333333,2.224,0.0,0.0,0.0
#follow to #download Dell inspiron 5100 notebook User Manual - TB006500570012 @ServiceRepair23,0.0,0.0,0.0,0.0,0.0,0.0,0.0,0.0,0.0,0.0,0.0
Notebook Dell Inspiron I14-3421-A10 Preço: R$950 Pouquíssimo uso!!!!! Está em excelente estado! Na caixa!!... http://fb.me/7nAVAX2uP,0.0313461538461538,0.8150000000000001,0.0054230769230769,0.141,0.0300384615384615,0.781,0.0228846153846153,0.595,0.0,0.0,0.0
Notebook Dell Inspirion 14 8GB de Memória e 500GB de HD http://produto.mercadolivre.com.br/MLB-675186327-notebook-dell-inspirion-14-8gb-memoria-500gb-hd-_JM …,0.0689333333333333,1.034,-0.0738666666666666,-1.108,0.1702,2.553,0.1416,2.124,0.0,0.0,0.0
Comprei um notebook novo... eu tinha um da HP e comprei agora um da Dell.,-0.0593529411764705,-1.009,0.0681764705882353,1.159,-0.1719411764705882,-2.923,-0.0564117647058823,-0.959,-0.0062941176470588,-0.107,0.0
"@simpson_yuri eita mano... Notebook da Dell é foda vei kkkk, vc é um felizardo hahhaha joga na mega-sena logo kkkk",-0.0282272727272727,-0.621,0.0,0.0,-0.0402727272727272,-0.886,-0.0228181818181818,-0.502,0.0,0.0,1.0
#DELL #LAPTOP LATITUDE COMPUTER #WINDOWS 7 CORE 2 DUO 3GB RAM #DVD #WIFI #NOTEBOOK #HD #BuyNOW $117.94 #deal http://ebay.to/1KE7KB5,0.0260666666666666,0.782,0.0274333333333333,0.823,0.0,0.0,0.0178333333333333,0.535,0.0,0.0,0.0
"maior arrependimento da minha vida foi ter dado 4 mil reais no notebook da dell. jesus, tira essa raiva de mim!!!!",0.0972962962962962,2.627,0.0088518518518518,0.239,0.0678888888888888,1.833,0.0668888888888888,1.806,0.0286296296296296,0.773,1.0
Esse notebook da Dell é uma verdadeira merda,0.127125,1.017,0.010125,0.081,0.046,0.368,0.04375,0.35,-0.051875,-0.415,1.0
Me ajudem alguém sabe o modelo do Notebook Dell que atrás acende a logo na tampa quem souber vai me ajudar muito!,0.0687391304347826,1.5810000000000002,-0.0234347826086956,-0.5389999999999999,0.096695652173913,2.224,0.0561739130434782,1.2919999999999998,0.0265217391304347,0.6100000000000001,0.0
"Quero esse notebook com touch da dell, ainda vem com uma Stylus",-0.0574615384615384,-0.747,0.0,0.0,0.0,0.0,-0.0401538461538461,-0.522,-0.0629230769230769,-0.818,0.0
"Entro no site da dell com a intenção de comprar o notebook mais barato, aí eles fazem a comparação com os mais caros...",0.03608,0.902,-0.0058399999999999,-0.1459999999999999,0.0324,0.8099999999999999,0.04916,1.229,-0.0030399999999999,-0.076,1.0
Dell Latitude E6400 Notebook http://www.24marketing.org/dell-latitude-e6400-notebook-2/ …,0.0,0.0,0.0,0.0,0.0,0.0,0.0,0.0,0.0,0.0,0.0
Notebooks Dell! Tecnologia poderosa sempre com você http://migre.me/qmD4L  + Cupom de Desconto: RCA-27231,0.10275,1.644,-0.0289374999999999,-0.4629999999999998,0.1746249999999999,2.794,0.1461875,2.339,-0.003,-0.048,0.0
"@DellAjuda Meu notebook está com a tela piscando, entrei em contato com a Dell e vão me enviar um orçamento",-0.0747142857142857,-1.569,0.0024761904761904,0.052,-0.005095238095238,-0.1069999999999999,-0.0147619047619047,-0.3099999999999999,0.0447619047619047,0.94,0.0
Meu notebook tá todo fodido. Tenho é que começar a trabalhar logo pra comprar outro e um outro cel também. Quero outro Dell,0.10672,2.668,0.12636,3.1590000000000007,-0.02584,-0.646,0.0692,1.73,-0.00984,-0.246,1.0
"Notebook Dell, um monstro de performance, um bosta pra sinal wi-fi",-0.0136153846153846,-0.1769999999999999,-0.0029230769230769,-0.0379999999999999,-0.0953076923076923,-1.239,0.0103846153846153,0.1350000000000001,-0.007,-0.091,1.0
"Dell Latitude E5500 15.4"" Notebook Core2Duo @ 2.26GHz, 1GB, No HD- Boots to BIOS …http://buy-it-now-unbelievable-offer.buy2day.info/buy/01/?query=111710283759 …  Link permanente da imagem incorporada",-0.0495925925925925,-1.339,0.0064074074074074,0.173,-0.0579259259259259,-1.564,-0.054074074074074,-1.46,0.0537777777777777,1.452,0.0
"Depois de 56 (!) minutos com o suporte telefônico da Dell, terei q enviar o notebook para a assistência.",0.0635652173913043,1.462,-0.0346521739130434,-0.7969999999999999,0.1057826086956521,2.433,0.0927391304347826,2.133,0.0,0.0,1.0
"@ofernandoreis isso rolou com meu notebook da Dell. Era poeira nos difusores de saída de ar quente. Desmontei, limpei e resolveu.",0.0626399999999999,1.5659999999999998,-0.0598399999999999,-1.4959999999999998,0.13528,3.382,0.11224,2.806,0.0,0.0,0.0
@DellnoBrasil Oi Dell! Vocês não tem mais notebook com drive de Blu-ray?,0.0932142857142857,1.3050000000000002,-0.1159285714285714,-1.623,0.1101428571428571,1.5419999999999998,0.1064285714285714,1.49,0.0,0.0,0.0
Ofertas em Notebooks DELL http://migre.me/oEfq1  + Cupom de Desconto: RCA-27231,0.12325,1.479,-0.0505833333333333,-0.607,0.2259166666666666,2.7110000000000003,0.1853333333333333,2.224,0.0,0.0,0.0
Performance de Notebook. Mobilidade de Tablet http://migre.me/pVRcE  + Cupom de Desconto: RCA-27231,0.1771333333333333,2.657,-0.1702,-2.553,0.2927333333333333,4.391,0.2550666666666666,3.826,0.0,0.0,0.0
Notebook da Dell é muito bom ???,-0.0853333333333333,-0.768,0.0,0.0,-0.0656666666666666,-0.591,-0.0707777777777777,-0.637,0.0614444444444444,0.553,1.0
"a propósito, vi um notebook lindo hoje, da Dell, era quadradão do jeito q eu gosto asoidhjasiofd",0.0158,0.316,0.00605,0.121,-0.0098,-0.196,0.00405,0.081,0.0,0.0,1.0
Acheiiiiiiii http://fb.me/318I7YanN,0.0,0.0,0.0,0.0,0.0,0.0,0.0,0.0,0.0,0.0,0.0
Notebooks Dell! Tecnologia poderosa sempre com você http://migre.me/qmD4L  + Cupom de Desconto: RCA-27231,0.10275,1.644,-0.0289374999999999,-0.4629999999999998,0.1746249999999999,2.794,0.1461875,2.339,-0.003,-0.048,0.0
"Dell Latitude E6500 15.4"" Notebook …http://best-very-impressive-items.buy2day.info/buy/01/?query=141708762342 …  Link permanente da imagem incorporada",-0.0892666666666666,-1.339,0.0115333333333333,0.173,-0.1042666666666666,-1.564,-0.0973333333333333,-1.46,0.0968,1.452,0.0
Ôh Aidar vende pra mim?,0.0,0.0,0.0,0.0,0.0,0.0,0.0,0.0,0.0,0.0,0.0
Meu notebook não ta ligando @Dell ?,0.0,0.0,0.0,0.0,0.0,0.0,0.0,0.0,0.0,0.0,1.0
"De acordo com a analise realizada por nosso consultor, este computador é o que melhor irá se adequar as suas... http://fb.me/6UH18edWI",0.0443043478260869,1.019,-0.0325217391304347,-0.748,0.042391304347826,0.975,0.0444782608695652,1.023,-0.005391304347826,-0.124,0.0
Notebooks Dell! Tecnologia poderosa sempre com você http://migre.me/qmD4L  + Cupom de Desconto: RCA-27231,0.10275,1.644,-0.0289374999999999,-0.4629999999999998,0.1746249999999999,2.794,0.1461875,2.339,-0.003,-0.048,0.0
Dá uma olhada nessa reclamação contra @DellnoBrasil Computadores do Brasil no @ReclameAQUI - ... http://www.reclameaqui.com.br/13629753/dell-computadores-do-brasil/notebook-dell-aparelhos-de-terceira-categoria/ …,-0.0073125,-0.117,0.004875,0.078,-0.0131875,-0.211,-0.00825,-0.132,-0.009125,-0.146,1.0
obrigado michael da dell pela atenção migo mas meu notebook voltou a estar bem,0.0535714285714285,0.75,0.0699999999999999,0.98,0.0657142857142857,0.92,0.0630714285714285,0.883,0.0,0.0,1.0
Para que escolher entre tablet e notebook se você pode ter o melhor dos dois com o Latitude 13 2 em 1 Série 7000. O…http://dell.to/1R23sqS,0.0530714285714285,1.486,-0.0038571428571428,-0.1079999999999999,0.0365357142857142,1.023,0.0425357142857142,1.191,-0.0163214285714285,-0.457,0.0
@DellAjuda ola tenho um notebook dell e queria desabilitar a função backup recovery porque o sistema trava ou fica lento. Obrigado.,0.0405217391304347,0.932,0.0127391304347826,0.293,-0.048391304347826,-1.113,0.0150434782608695,0.3460000000000001,-0.0305652173913043,-0.703,0.0
"@confidobrev samsung, sony e dell são as melhores pra notebook",0.0171818181818181,0.189,0.007,0.077,0.0184545454545454,0.203,0.0141818181818181,0.156,0.0,0.0,1.0
Ofertas em Notebooks DELL http://migre.me/oEfq1  + Cupom de Desconto: RCA-27231,0.12325,1.479,-0.0505833333333333,-0.607,0.2259166666666666,2.7110000000000003,0.1853333333333333,2.224,0.0,0.0,0.0
@DellnoBrasil ow dell na onde q ver meus pedidos no site de vocês? Tô tentando comprar esse notebook http://www.dell.com/br/p/inspiron-15-5548-laptop/pd?oc=cai5548w8s1612656brp052w&model_id=inspiron-15-5548-laptop … e não consigo,0.0295,0.708,-0.0404583333333333,-0.971,0.0357083333333333,0.857,0.0371666666666666,0.8920000000000001,-0.004875,-0.117,0.0
To querendo um notebook novo. Eu to vendo um Dell e um da apple. Mas eu tenho sérios problemas com teclado pequeno.,-0.14044,-3.511,0.00684,0.171,-0.18608,-4.652,-0.1187599999999999,-2.9689999999999994,0.02828,0.707,0.0
"Boa tarde! Tem Notebook Dell com i3, 4GB de memória e HD de 500GB, vai ficar de fora dessa? Confere só!... http://fb.me/1Tnq4aXhW",0.0451333333333333,1.354,-0.0888,-2.664,0.0834999999999999,2.5049999999999994,0.0710666666666666,2.132000000000001,-0.0017666666666666,-0.053,0.0
Performance de Notebook. Mobilidade de Tablet http://migre.me/pVRcE  + Cupom de Desconto: RCA-27231,0.1771333333333333,2.657,-0.1702,-2.553,0.2927333333333333,4.391,0.2550666666666666,3.826,0.0,0.0,0.0
Finalmente meu notebook novo chegou! Agora eu 'tou com a @Dell.,0.0798571428571428,1.118,0.0827857142857142,1.159,0.0033571428571428,0.047,0.0527857142857142,0.739,-0.0076428571428571,-0.107,1.0
Notebook da Dell Precision tem alta performance em edição de vídeo http://tinyurl.com/p9a9dou,0.0429166666666666,0.5150000000000001,-0.1235833333333333,-1.483,0.0765833333333333,0.919,0.0691666666666666,0.83,0.0506666666666666,0.608,0.0
"@whatived0ne eu tenho notebook e ps4. mas comprei o note pensando em jogar, claro. é da dell e tem uma placa de vídeo dedicada de 2gb",0.1117333333333333,3.352,-0.0847333333333333,-2.542,0.1108999999999999,3.3269999999999995,0.1199333333333333,3.5980000000000003,0.0,0.0,0.0
notebook natinha...http://www.walmart.com.br/produto/Informatica/Notebooks/Acer/493 …... — o segundo! dell eh vida <3 http://ask.fm/a/c919n8lb,0.074,1.036,0.0847857142857142,1.187,0.0739285714285714,1.035,0.075,1.05,-0.0077142857142857,-0.108,1.0
Torcendo pra Dell agilizar logo minha situação pra eu não precisar ir no Procon. Tanto problema só pq eu quis comprar um notebook bom.,0.0131923076923076,0.3430000000000001,0.001076923076923,0.028,-0.0148846153846153,-0.387,0.0131538461538461,0.3419999999999999,-0.0360384615384615,-0.937,1.0
"Por isso não gosto desse notebook Dell, vive pedindo atualização e demora um ano pra ligar depois",0.0030555555555555,0.055,0.0306111111111111,0.5509999999999999,0.0306666666666666,0.552,0.0255555555555555,0.4599999999999999,0.0003333333333333,0.0059999999999999,1.0
#BOMDIA com esse super notebook com qualidade Dell! Confira: http://bit.ly/1BQOgWx   Link permanente da imagem incorporada,-0.0224210526315789,-0.426,-0.0408947368421052,-0.7769999999999999,-0.0356315789473684,-0.6769999999999999,-0.028578947368421,-0.5429999999999999,0.0764210526315789,1.452,0.0
Conheça o Notebook Dell 2 em 1: Tablet + Notebook! Aproveite o desconto e garanta o seu aqui: http://bit.ly/1eUYJq1   Link permanente da imagem incorporada,-0.0478214285714285,-1.339,0.0396428571428571,1.11,-0.0219285714285714,-0.614,-0.0296785714285714,-0.831,0.0518571428571428,1.452,0.0
#BOMDIA com esse super notebook com qualidade Dell! Confira: http://bit.ly/1C1wK2m   Link permanente da imagem incorporada,-0.0213,-0.426,-0.0388499999999999,-0.7769999999999999,-0.03385,-0.6769999999999999,-0.0271499999999999,-0.5429999999999999,0.0726,1.452,0.0
Vamos começar a semana com a qualidade Dell! Conheça o Notebook Dell 2 em 1 e garanta o seu: http://bit.ly/1eUTbMc   Link permanente da imagem incorporada,-0.0002857142857142,-0.0080000000000001,-0.0173928571428571,-0.4869999999999999,-0.0241785714285714,-0.6769999999999999,-0.0141428571428571,-0.3959999999999999,0.0423928571428571,1.187,0.0
Tô há quatro meses com o notebook da Dell e os graves do som já estão fodidos.....................,0.0112222222222222,0.202,0.0054444444444444,0.098,0.0012222222222222,0.022,0.0059444444444444,0.107,0.0,0.0,1.0
"Retirando HD Notebook Dell para Realização de Backup Total em Cliente ""Amigo"" em Varginha / MG.",0.0406842105263157,0.773,-0.0512105263157894,-0.973,0.0586842105263157,1.115,0.0502105263157894,0.954,0.0,0.0,0.0
@DellnoBrasil Sonho de consumo um notebook da dell #dell dau ma moral ai,-0.0287857142857142,-0.4029999999999999,-0.0733571428571428,-1.027,-0.0225,-0.315,0.0043571428571428,0.061,-0.009,-0.126,0.0
"qual a melhor marca de notebook gnt, asus ou dell??? (não vem com apple pro meu lado nao que n tenho dinheiro)",0.06225,1.743,-0.0176428571428571,-0.494,0.0415357142857142,1.1629999999999998,0.0514642857142857,1.441,-0.0139285714285714,-0.39,0.0
"Vou mandar esse notebook de volta pra DELL com uma bomba atômica dentro, porque é uma porcaria mesmo",0.0146842105263157,0.279,-0.0315263157894736,-0.599,0.0421052631578947,0.7999999999999999,0.0263157894736842,0.5,-0.0486315789473684,-0.924,1.0
"Extra – Imperdível Oferta 30% OFF no Notebook Dell Inspiron I14-3443-A30 com Intel Core i5-5200U, 4GB, 1TB,… http://www.cupomdesconto.blog.br/coupon/extra-imperdivel-oferta-30-off-no-notebook-dell-inspiron-i14-3443-a30-com-intel-core-i5-5200u-4gb-1tb-gravador-de-dvd-leitor-de-cartoes-led-14-windows-8-1-e-antivirus-mcafee/ …",0.0229615384615384,0.597,0.0205,0.533,-0.0028076923076923,-0.073,0.0091538461538461,0.238,-0.0131923076923076,-0.3429999999999999,0.0
Meu notebook Dell tem um diacho de um programa em segundo plano de recovery que não tem nenhuma opção de desativar.,0.0911818181818182,2.006,-0.1823181818181818,-4.011,0.0927727272727272,2.041,0.1273181818181818,2.801,-0.0049090909090909,-0.108,1.0
Ofertas em Notebooks DELL http://migre.me/oEfq1  + Cupom de Desconto: RCA-27231,0.12325,1.479,-0.0505833333333333,-0.607,0.2259166666666666,2.7110000000000003,0.1853333333333333,2.224,0.0,0.0,0.0
Performance de Notebook. Mobilidade de Tablet http://migre.me/pVRcE  + Cupom de Desconto: RCA-27231,0.1771333333333333,2.657,-0.1702,-2.553,0.2927333333333333,4.391,0.2550666666666666,3.826,0.0,0.0,0.0
"Planejando trocar seu notebook? Na Papel e Cia, compre um Dell que vale por dois! Confira no Piso L2 – SUL ;)  Link permanente da imagem incorporada",-0.0390322580645161,-1.21,-0.0230967741935483,-0.7160000000000002,-0.055258064516129,-1.713,-0.0386129032258064,-1.197,0.0493870967741935,1.531,0.0
"VAI TOMAR NO CÚ! SÓ PASSO RAIVA COM ESSA MERDA DE NOTEBOOK!!! Jamais comprem produtos Dell, é uma bosta!",0.01856,0.4639999999999999,-0.03568,-0.892,0.0204,0.51,-0.0038,-0.095,0.0593999999999999,1.485,1.0
Hoje é comemorado o Dia Nacional do Progresso. Então que tal aproveitar a data e dar um upgrade no seu notebook? http://del.ly/6019BBcSJ,0.0834166666666666,2.002,0.027,0.648,0.04575,1.098,0.0650416666666666,1.5610000000000004,-0.0122499999999999,-0.294,0.0
APROVEITE!,0.0,0.0,0.0,0.0,0.0,0.0,0.0,0.0,0.0,0.0,0.0
@americanascom boa tarde! Tem desconto para notebook Dell Inspiron I14? Preciso muito comprar um. Me ajuda ai!,-0.0345714285714285,-0.726,0.0136190476190476,0.2860000000000001,-0.0006666666666666,-0.0139999999999999,0.0083809523809523,0.1760000000000001,0.0203333333333333,0.427,0.0
"Dell Latitude E6500 15.4"" Notebook …http://special-online-deals-impressive-offers.newoffers.info/buy/01/?query=141704060715 …  Link permanente da imagem incorporada",-0.0892666666666666,-1.339,0.0115333333333333,0.173,-0.1042666666666666,-1.564,-0.0973333333333333,-1.46,0.0968,1.452,0.0
O Dell XPS 13 é um notebook estiloso voltado para a produtividade.   http://info.abril.com.br/multimidia/tv/notebooks/dell-xps-13-e-a-ferrari-dos-notebooks-34cbce61aaa538a73d6ab7e60e8a8906.shtml … via @_INFO  Link permanente da imagem incorporada,-0.0829166666666666,-1.99,0.0072083333333333,0.173,-0.1055416666666666,-2.533,-0.0833333333333333,-2.0,0.0605,1.452,0.0
"Vendo notebook Dell Super conservado.Só venda mesmo! R$ 550,00 a Vista ou 600,00 em até 12 Vezes (com juros)... http://fb.me/3BWJ0YxBS",0.0603461538461538,1.569,-0.0129615384615384,-0.3369999999999999,0.0638461538461538,1.66,0.0637307692307692,1.657,0.0285,0.741,0.0
". @Dell R$ 1.603,29 pra trocar só a tela de um notebook que custou R$ 2399? Cês tão de zoeira?",0.0608636363636363,1.3390000000000002,-0.1216818181818181,-2.677,0.0692272727272727,1.523,0.0852272727272727,1.8750000000000004,-0.0023636363636363,-0.052,1.0
Performance de Notebook. Mobilidade de Tablet http://migre.me/pVRcE  + Cupom de Desconto: RCA-27231,0.1771333333333333,2.657,-0.1702,-2.553,0.2927333333333333,4.391,0.2550666666666666,3.826,0.0,0.0,0.0
"@magazineluiza https://m.magazineluiza.com.br/notebook-dell-serie-5000-inspiron-15-intel-core-i5-8gb-1tb-windows-8.1-tela-15-6-placa-de-video-2gb/p/1352264/in/nodl/ … ele tava por 2300 e poucos a vista no carrinho ja, quando fui comprar ""aconteceu"" isso..",0.0697826086956521,1.605,0.001,0.023,0.0656521739130434,1.51,0.0659130434782608,1.5160000000000002,0.0,0.0,0.0
"@adrianomg_s Olá, POATARTI! Opa, vemk http://pingu.im/1BSWluh  =)",0.0828181818181818,0.911,0.0,0.0,0.0669090909090909,0.736,0.0499090909090909,0.549,0.0,0.0,0.0
"@Lais_HS Olá, POATARTI! Que tal: http://pingu.im/1LAC6EL  =)",0.0828181818181818,0.911,0.0,0.0,0.0669090909090909,0.736,0.0499090909090909,0.549,0.0,0.0,0.0
@rbnave eu to jogando num notebook dell 2010 podridão edition,0.0,0.0,0.0,0.0,0.0,0.0,0.0,0.0,0.0,0.0,1.0
@magazineluiza preciso de um notebook da Dell Inspiron 14. Rola aquele desconto?,-0.0067857142857142,-0.0949999999999999,0.0054285714285714,0.076,0.0571428571428571,0.7999999999999999,0.065,0.91,0.0,0.0,0.0
"@pontofrio me ajuda! Agora preciso comprar um notebook da Dell Inspiron 14. E, como sempre, tenho pouca grana. Estou decidindo por preço...",0.0125714285714285,0.3520000000000001,0.0406428571428571,1.138,-0.0332142857142857,-0.93,0.0096785714285714,0.2710000000000002,0.0,0.0,0.0
aceitando um notebook novo da Dell ou um PS4 de presente vlw flw,0.0013076923076923,0.017,-0.0616923076923076,-0.8019999999999999,-0.0108461538461538,-0.141,0.0235384615384615,0.306,-0.0082307692307692,-0.107,0.0
Análise: notebook Dell Inspiron 13 série 7000 [vídeo] http://www.tecmundo.com.br/dell-inspiron-13-7000/82150-analise-notebook-dell-inspiron-13-serie-7000-video.htm … via @Tec_Mundo,0.0933333333333333,1.4,0.0047333333333333,0.071,0.0606,0.909,0.0890666666666666,1.336,0.0,0.0,0.0
"Notebook dell intel core 2 duos - Computadores e acessórios - Itaúna, São Gonçalo , bomnegócio... http://fb.me/7yZIm0ieS",0.0099473684210526,0.189,0.0040526315789473,0.077,0.0106842105263157,0.203,0.0082105263157894,0.156,0.0,0.0,0.0
Ofertas em Notebooks DELL http://migre.me/oEfq1  + Cupom de Desconto: RCA-27231,0.12325,1.479,-0.0505833333333333,-0.607,0.2259166666666666,2.7110000000000003,0.1853333333333333,2.224,0.0,0.0,0.0
"Genteee, a Dell finalmente entregou meu notebook, a partir de amanhã começo a atualizar o FC, tô muito feliz ???",0.0501999999999999,1.255,-0.02564,-0.641,0.07952,1.988,0.0674,1.685,0.02212,0.553,0.0
"Gnt, mandei uns tweets pra Dell kkkkkkkkkk pra eles me darem um notebook novo, pq não sei de onde tirarei dinheiro pra comprar um novo",0.015074074074074,0.407,-0.0604814814814814,-1.6329999999999998,-0.0162222222222222,-0.438,0.0271851851851851,0.734,-0.0111111111111111,-0.3,0.0
"@DellnoBrasil então venho por meio deste Tweet pedir um notebook novo, pois me sinto no direito de pedir pois sempre índico Dell para todos",0.02456,0.614,-0.05504,-1.376,0.01516,0.3790000000000001,0.03452,0.863,-0.01604,-0.401,0.0
"@DellnoBrasil por favor, sou estudante de Arquitetura e necessito de um notebook novo, pois o meu, Dell, já tem mais de 4 anos +",0.1157142857142857,3.24,-0.0763214285714285,-2.137,0.1229999999999999,3.4439999999999995,0.1343928571428571,3.763,-0.0141785714285714,-0.3969999999999999,0.0
#luanz Análise: notebook Dell Inspiron 13 série 7000 [vídeo] http://ow.ly/30yU8w,0.0958571428571428,1.342,0.0050714285714285,0.071,0.0634285714285714,0.888,0.0935714285714285,1.31,0.0,0.0,0.0
Análise: notebook Dell Inspiron 13 série 7000 [vídeo]: Modelo com tela sensível ao toque se destaca pela versa... http://bit.ly/1LHlF6l,0.0931666666666666,2.236,0.0227083333333333,0.545,0.0741666666666666,1.78,0.0936666666666666,2.248,0.0233749999999999,0.5609999999999999,0.0
#betalab Análise: notebook Dell Inspiron 13 série 7000 [vídeo]: Modelo com tela sensível ao toque se destaca p... http://bit.ly/1fH5fAR,0.08944,2.236,0.0218,0.545,0.0712,1.78,0.08992,2.248,0.0224399999999999,0.5609999999999999,0.0
Análise: notebook Dell Inspiron 13 série 7000 [vídeo] http://bit.ly/1fH5fAR,0.1118333333333333,1.342,0.0059166666666666,0.071,0.074,0.888,0.1091666666666666,1.31,0.0,0.0,0.0
Análise: notebook Dell Inspiron 13 série 7000 [vídeo]: Modelo com tela sensível ao toque se destaca pela versa... http://bit.ly/1fH5fAR,0.0931666666666666,2.236,0.0227083333333333,0.545,0.0741666666666666,1.78,0.0936666666666666,2.248,0.0233749999999999,0.5609999999999999,0.0
